{
  "schema_version": "changedrop-script-authoring/1",
  "setup": [
    {
      "instruction": "Wait for the editing-size readout.",
      "action": "wait-for",
      "selector": "#readout",
      "state": "visible"
    },
    {
      "instruction": "Wait for demo controls to become interactive.",
      "action": "wait-for",
      "selector": "#fte-pause",
      "state": "enabled"
    }
  ],
  "bookends": {
    "intro_walkthrough": [
      {
        "instruction": "Establish the editor with the game view and HUD visible.",
        "action": "hold",
        "duration_ms": 4200,
        "fit": "narration"
      }
    ],
    "outro_walkthrough": [
      {
        "instruction": "Hold on the completed editor view.",
        "action": "hold",
        "duration_ms": 4200,
        "fit": "narration"
      }
    ]
  },
  "treatments": [
    {
      "surface": "window-follow",
      "source": {
        "before": "Resizing the browser could leave the game view at its boot size and overlay handles out of alignment.",
        "after": "The live game view grows or shrinks with the browser, every overlay handle stays on its element, and the engine reports both virtual console size and true backing-store pixels.",
        "value": "The editing-size readout and the HUD stay aligned with the picture on screen."
      },
      "text": "Resizing the browser now keeps your game view and HUD controls aligned.",
      "walkthrough": [
        {
          "instruction": "Show the game view at the smaller browser size.",
          "action": "resize",
          "width": 1280,
          "height": 720
        },
        {
          "instruction": "Hold briefly on the smaller game view.",
          "action": "hold",
          "duration_ms": 500
        },
        {
          "instruction": "Resize the browser and let the game view follow.",
          "action": "resize",
          "width": 1536,
          "height": 864
        },
        {
          "instruction": "Wait for the resized editing-size readout.",
          "action": "wait-for",
          "selector": "#readout",
          "state": "visible"
        },
        {
          "instruction": "Ring the changed editing-size readout.",
          "action": "highlight",
          "selector": "#readout",
          "badge": 1,
          "crop": {"width": 500, "height": 270}
        },
        {
          "instruction": "Hold on the aligned resized view.",
          "action": "hold",
          "duration_ms": 3000,
          "fit": "narration"
        }
      ]
    },
    {
      "surface": "pause-resume",
      "source": {
        "before": "The editor had no Pause or Resume control, so lining up the HUD meant waiting for a useful demo frame.",
        "after": "Pause and Resume sit beside the demo selector and follow the engine's real state, including console changes and an honest disabled reason on unsupported backends.",
        "value": "You can stop on a quiet frame and adjust the HUD without losing the moment you wanted."
      },
      "text": "Pause now holds frames steady, so you can edit the HUD without losing your moment.",
      "walkthrough": [
        {
          "instruction": "Ring the Pause control while it still reads Pause.",
          "action": "highlight",
          "selector": "#fte-pause",
          "badge": 1,
          "crop": {"width": 550, "height": 300}
        },
        {
          "instruction": "Pause the running demo from the editor control.",
          "action": "click",
          "selector": "#fte-pause"
        },
        {
          "instruction": "Wait for engine readback to confirm the pause.",
          "action": "wait-for",
          "selector": "#fte-pause",
          "state": "pressed"
        },
        {
          "instruction": "Hold on the steady demo frame.",
          "action": "hold",
          "duration_ms": 3000,
          "fit": "narration"
        },
        {
          "instruction": "Resume demo playback from the same control.",
          "action": "click",
          "selector": "#fte-pause"
        },
        {
          "instruction": "Wait for engine readback to confirm playback.",
          "action": "wait-for",
          "selector": "#fte-pause",
          "state": "unpressed"
        }
      ]
    }
  ]
}
